{"$defs":{"BinaryWireV1":{"additionalProperties":false,"properties":{"byte_length":{"format":"uint64","minimum":0,"type":"integer"},"data":{"type":"string"},"encoding":{"type":"string"}},"required":["encoding","data","byte_length"],"type":"object"},"VersionedCodeWireV1":{"additionalProperties":false,"properties":{"code":{"type":"string"},"other_code":{"format":"uint16","maximum":65535,"minimum":0,"type":["integer","null"]},"version":{"format":"uint16","maximum":65535,"minimum":0,"type":["integer","null"]}},"required":["code"],"type":"object"}},"$id":"schemas/evidentrail/v1/event_block_record.schema.json","$schema":"https://json-schema.org/draft/2020-12/schema","additionalProperties":false,"properties":{"block_id":{"pattern":"^blk_[0-9a-f]{64}$","type":"string"},"confidence":{"type":"string"},"contract":{"const":"evidentrail.event_block_record","type":"string"},"contract_version":{"const":1,"format":"uint16","maximum":9007199254740991,"minimum":0,"type":"integer"},"framing_policy":{"$ref":"#/$defs/BinaryWireV1"},"framing_policy_version":{"$ref":"#/$defs/BinaryWireV1"},"lane_member":{"$ref":"#/$defs/BinaryWireV1"},"lane_sequences":{"items":{"format":"uint64","maximum":9007199254740991,"minimum":0,"type":"integer"},"maxItems":4096,"type":"array"},"ordered_event_ids":{"items":{"type":"string"},"maxItems":4096,"type":"array"},"ordinal":{"format":"uint64","maximum":9007199254740991,"minimum":0,"type":"integer"},"retrieval_id":{"pattern":"^ret_[0-9a-f]{64}$","type":"string"},"state":{"type":"string"},"stream":{"$ref":"#/$defs/VersionedCodeWireV1"}},"required":["contract","contract_version","retrieval_id","block_id","ordinal","lane_member","stream","ordered_event_ids","lane_sequences","framing_policy","framing_policy_version","state","confidence"],"title":"evidentrail.event_block_record","type":"object"}