{"block_id":"blk_0000000000000000000000000000000000000000000000000000000000000000","confidence":"certain","contract":"evidentrail.event_block_record","contract_version":1,"framing_policy":{"byte_length":0,"data":"","encoding":"base64url-nopad"},"framing_policy_version":{"byte_length":0,"data":"","encoding":"base64url-nopad"},"lane_member":{"byte_length":0,"data":"","encoding":"base64url-nopad"},"lane_sequences":[0],"ordered_event_ids":["evt_0000000000000000000000000000000000000000000000000000000000000000"],"ordinal":0,"retrieval_id":"ret_0000000000000000000000000000000000000000000000000000000000000000","state":"fallback_singleton","stream":{"code":"stdout","other_code":null,"version":null}}